{
  "$schema": "https://json-schema.org/draft/2020-12/schema",
  "$id": "https://avocadolinux.org/schema/avocado-cve-report-v1.schema.json",
  "title": "Avocado CVE report, version 1",
  "description": "The report meta-avocado-sbom publishes and avocado-cli consumes. The shape is frozen, the contents are not: nothing here constrains which packages, recipes or CVEs appear, or how many. Unknown keys are permitted - additions do not bump the major. See meta-avocado-sbom/README.",
  "type": "object",
  "required": [
    "version",
    "generated",
    "packages_digest",
    "status",
    "counts",
    "recipes",
    "packages",
    "unscanned_recipes",
    "no_cve_record_recipes"
  ],
  "properties": {
    "version": {
      "description": "A consumer must reject a major it does not implement rather than read the parts it recognises.",
      "type": "string",
      "const": "1"
    },
    "generated": {
      "description": "UTC, second resolution, Z-suffixed.",
      "type": "string",
      "pattern": "^\\d{4}-\\d{2}-\\d{2}T\\d{2}:\\d{2}:\\d{2}Z$"
    },
    "machine": {
      "description": "MACHINE the report describes. Absent on a standalone run without --machine.",
      "type": "string"
    },
    "distro_version": {
      "description": "Written by the avocado-cve-report recipe, so absent from a standalone run.",
      "type": "string"
    },
    "packages_digest": {
      "description": "sha256 over the package set: name, recipe and version, tab-separated, one line each, in package-name order. Re-derivable by a consumer.",
      "type": "string",
      "pattern": "^sha256:[0-9a-f]{64}$"
    },
    "status": {
      "description": "The status the report was filtered on, or All for a report that lists every status and names each CVE's own in its 'status'. All is not a status cve-check emits.",
      "enum": ["Unpatched", "Patched", "Ignored", "All"]
    },
    "counts": {
      "description": "Every counter is present and numeric in every report. The health counters are zero in a report fit to publish; that is enforced by the CI check rather than here, since such a report is still structurally valid.",
      "type": "object",
      "required": [
        "recipes",
        "cves",
        "packaged_recipes",
        "packaged_cves",
        "device_recipes",
        "device_cves",
        "packages",
        "cve_files",
        "stale_dropped",
        "unscanned_recipes",
        "no_cve_record_recipes",
        "cve_files_unreadable",
        "pkgdata_unreadable",
        "package_collisions",
        "unpatched_cves",
        "ignored_cves",
        "patched_cves",
        "unknown_status_cves",
        "manifests_read",
        "alt_recipes",
        "alt_cves"
      ],
      "additionalProperties": {
        "type": "integer",
        "minimum": 0
      },
      "properties": {
        "recipes": {
          "description": "Entries in 'recipes'. Equals len(recipes).",
          "type": "integer",
          "minimum": 0
        },
        "cves": {
          "description": "CVEs over all recipes. Equals the sum of the 'cves' lists.",
          "type": "integer",
          "minimum": 0
        },
        "packaged_recipes": {
          "description": "Recipes with packaged true. Zero means nothing correlated to anything installed.",
          "type": "integer",
          "minimum": 0
        },
        "packaged_cves": {
          "description": "CVEs over recipes with packaged true.",
          "type": "integer",
          "minimum": 0
        },
        "device_recipes": {
          "description": "Recipes whose scope is anything but build-only, so they reach the device. Not the same set as packaged_recipes.",
          "type": "integer",
          "minimum": 0
        },
        "device_cves": {
          "description": "CVEs over recipes that reach the device. The headline number.",
          "type": "integer",
          "minimum": 0
        },
        "packages": {
          "description": "Entries in 'packages'. Equals len(packages).",
          "type": "integer",
          "minimum": 0
        },
        "cve_files": {
          "description": "cve-check result files consumed. Not derivable from this document.",
          "type": "integer",
          "minimum": 0
        },
        "stale_dropped": {
          "description": "Health. cve-check entries discarded because no recipe in pkgdata built that version; their CVEs are missing here.",
          "type": "integer",
          "minimum": 0
        },
        "unscanned_recipes": {
          "description": "Length of the top-level unscanned_recipes list. Counted over pkgdata - everything this build produced - not over the image manifests scope reads, so no value of scope moves this denominator.",
          "type": "integer",
          "minimum": 0
        },
        "no_cve_record_recipes": {
          "description": "Length of the top-level no_cve_record_recipes list. Same pkgdata denominator as unscanned_recipes, and equally unmoved by scope.",
          "type": "integer",
          "minimum": 0
        },
        "cve_files_unreadable": {
          "description": "Health. cve-check files that would not parse, including valid JSON of the wrong shape.",
          "type": "integer",
          "minimum": 0
        },
        "pkgdata_unreadable": {
          "description": "Health. pkgdata entries that would not parse; those packages are missing from the lookup.",
          "type": "integer",
          "minimum": 0
        },
        "package_collisions": {
          "description": "Package names claimed by more than one recipe or version; the first pkgdata directory won. Not a health counter: the report is complete either way.",
          "type": "integer",
          "minimum": 0
        },
        "unpatched_cves": {
          "description": "Issues filtered out as Unpatched when the report was built for another status, and not derivable from this document. At status All nothing is filtered out: this counts the Unpatched CVEs the document lists, and is derivable.",
          "type": "integer",
          "minimum": 0
        },
        "ignored_cves": {
          "description": "Issues filtered out as Ignored; at status All, the Ignored CVEs listed. See unpatched_cves.",
          "type": "integer",
          "minimum": 0
        },
        "patched_cves": {
          "description": "Issues filtered out as Patched; at status All, the Patched CVEs listed. See unpatched_cves.",
          "type": "integer",
          "minimum": 0
        },
        "unknown_status_cves": {
          "description": "Issues whose status is none of the three cve-check emits. Non-zero means cve-check grew a status this generator does not know.",
          "type": "integer",
          "minimum": 0
        },
        "manifests_read": {
          "description": "Image manifests that named at least one package. Zero means no base runtime could be identified and every packaged recipe scopes 'feed' - a wider claim than the truth, not a narrower one. Per-scope totals are not counters: each recipe entry carries its own scope, so an aggregate cannot drift from the entries it summarises.",
          "type": "integer",
          "minimum": 0
        },
        "alt_recipes": {
          "description": "Recipes carrying at least one 'alt_versions' record. Zero on every single-kernel machine.",
          "type": "integer",
          "minimum": 0
        },
        "alt_cves": {
          "description": "CVEs over every 'alt_versions' record. Deliberately not part of 'cves' or 'packaged_cves', which stay the sum over the entries themselves, so a consumer that ignores alt_versions still reads counters describing exactly what it read.",
          "type": "integer",
          "minimum": 0
        }
      }
    },
    "recipes": {
      "description": "Recipes with at least one CVE at the reported status, keyed by PN. A recipe absent from here was scanned and clean, looked up with no NVD record, or never scanned - unscanned_recipes and no_cve_record_recipes separate the three.",
      "type": "object",
      "additionalProperties": {
        "type": "object",
        "required": ["version", "packaged", "scope", "cves"],
        "properties": {
          "version": {
            "type": "string"
          },
          "packaged": {
            "description": "False marks a recipe absent from pkgdata: -native and -cross, deploy-only target recipes that ship outside any package, and leftovers from a configuration this build no longer produces.",
            "type": "boolean"
          },
          "scope": {
            "description": "Which surface the recipe occupies. A label on the finding, never a filter on the report: the report stays feed-wide and the consumer chooses. 'boot-chain' is decided by recipe name, not package presence - u-boot and trusted-firmware-a ship outside any image manifest while running at the highest privilege on the device.",
            "enum": ["boot-chain", "base-runtime", "feed", "build-only"]
          },
          "cves": {
            "description": "Never empty; a recipe with no CVEs is absent from 'recipes'. Fields other than id are whatever cve-check supplied.",
            "type": "array",
            "minItems": 1,
            "items": {
              "type": "object",
              "required": ["id"],
              "properties": {
                "id": {
                  "type": "string",
                  "minLength": 1
                },
                "summary": { "type": "string" },
                "description": { "type": "string" },
                "detail": { "type": "string" },
                "status": {
                  "description": "This CVE's own cve-check status. Present on every CVE of a report at status All, where the report's own 'status' says nothing about any one of them, and absent otherwise.",
                  "enum": ["Unpatched", "Patched", "Ignored"]
                },
                "evidence": {
                  "description": "Who decided this issue's status. 'cve-status': a recipe declared it, and 'detail' names the CVE_STATUS keyword. 'patch-file': a patch this recipe applies names the CVE, so the fix is one we carry - the claim a consumer holding only an SBOM and an advisory feed cannot make. 'cve-check': cve-check decided a Patched issue itself and neither of the above applies, which normally means the shipped version falls outside every affected range. Absent on an Unpatched issue with no detail: nothing decided it, it is what the scan found. Without avocado-cve-backports.bbclass inherited no issue reports 'patch-file', and those issues report 'cve-check' instead.",
                  "enum": ["cve-status", "patch-file", "cve-check"]
                },
                "scorev2": { "type": "string" },
                "scorev3": { "type": "string" },
                "scorev4": { "type": "string" },
                "vector": { "type": "string" },
                "vectorString": { "type": "string" },
                "link": { "type": "string" }
              }
            }
          },
          "alt_versions": {
            "description": "The same recipe built at another version in the same build, and shipping into the same feed: a multi-kernel machine's second kernel, whose cve-check results avocado-multikernel.bbclass merges from the second multiconfig. Absent on every single-kernel machine, and never empty. Each record is the same shape as the entry - version, packaged, scope, cves - which is why it refers to the entry itself; the nesting that allows is never emitted. The entry stays the version the image installs, and its own 'cves' and the 'cves' counter exclude these, so a consumer that ignores the key under-reports knowably and 'alt_cves' says by how much.",
            "type": "array",
            "minItems": 1,
            "items": { "$ref": "#/properties/recipes/additionalProperties" }
          }
        }
      }
    },
    "packages": {
      "description": "Every runtime package, keyed by package name. CVEs live on the recipe, so a recipe shipping many packages does not duplicate its CVE list.",
      "type": "object",
      "additionalProperties": {
        "type": "object",
        "required": ["recipe", "version", "origin"],
        "properties": {
          "recipe": {
            "description": "PN. The join key into 'recipes'.",
            "type": "string",
            "minLength": 1
          },
          "version": {
            "description": "PKGV-PKGR, the package version rather than the recipe's.",
            "type": "string"
          },
          "origin": {
            "description": "pkgdata directory the entry came from: the machine, or the SDK.",
            "type": "string"
          }
        }
      }
    },
    "unscanned_recipes": {
      "description": "Recipes that shipped packages and have no cve-check entry at all: nothing looked at them. Normally non-zero - a recipe opts out with CVE_PRODUCT = '', which packagegroup.bbclass sets for every packagegroup. Disjoint from no_cve_record_recipes.",
      "type": "array",
      "items": {
        "type": "string",
        "minLength": 1
      }
    },
    "no_cve_record_recipes": {
      "description": "Recipes that shipped packages and were scanned, but whose products carry cvesInRecord 'No': the NVD holds no record under that product name. A scan result, not a coverage gap - though a wrong CVE_PRODUCT also lands here. Disjoint from unscanned_recipes and from recipes: cve-check writes 'No' for a product whose every record it ignored or found patched, so a recipe reporting CVEs at a status other than Unpatched stays in recipes and out of this list.",
      "type": "array",
      "items": {
        "type": "string",
        "minLength": 1
      }
    }
  }
}
