{
  "counts": {
    "alt_cves": 0,
    "alt_recipes": 0,
    "cve_files": 393,
    "cve_files_unreadable": 0,
    "cves": 8,
    "device_cves": 6,
    "device_recipes": 5,
    "ignored_cves": 99,
    "manifests_read": 2,
    "no_cve_record_recipes": 2,
    "package_collisions": 0,
    "packaged_cves": 6,
    "packaged_recipes": 5,
    "packages": 260,
    "patched_cves": 22073,
    "pkgdata_unreadable": 0,
    "recipes": 7,
    "stale_dropped": 0,
    "unknown_status_cves": 0,
    "unpatched_cves": 0,
    "unscanned_recipes": 1
  },
  "distro_version": "nodistro.0",
  "generated": "2026-08-19T18:10:29Z",
  "machine": "avocado-qemuarm64",
  "no_cve_record_recipes": [
    "libsm",
    "linux-firmware"
  ],
  "packages": {
    "acl": {
      "origin": "avocado-qemuarm64",
      "recipe": "acl",
      "version": "2.3.2-r0"
    },
    "avahi-autoipd": {
      "origin": "avocado-qemuarm64",
      "recipe": "avahi",
      "version": "0.8-r0"
    },
    "avahi-daemon": {
      "origin": "avocado-qemuarm64",
      "recipe": "avahi",
      "version": "0.8-r0"
    },
    "avahi-dbg": {
      "origin": "avocado-qemuarm64",
      "recipe": "avahi",
      "version": "0.8-r0"
    },
    "avahi-dev": {
      "origin": "avocado-qemuarm64",
      "recipe": "avahi",
      "version": "0.8-r0"
    },
    "avahi-dnsconfd": {
      "origin": "avocado-qemuarm64",
      "recipe": "avahi",
      "version": "0.8-r0"
    },
    "avahi-doc": {
      "origin": "avocado-qemuarm64",
      "recipe": "avahi",
      "version": "0.8-r0"
    },
    "avahi-locale-ach": {
      "origin": "avocado-qemuarm64",
      "recipe": "avahi",
      "version": "0.8-r0"
    },
    "avahi-locale-ar": {
      "origin": "avocado-qemuarm64",
      "recipe": "avahi",
      "version": "0.8-r0"
    },
    "avahi-locale-bg": {
      "origin": "avocado-qemuarm64",
      "recipe": "avahi",
      "version": "0.8-r0"
    },
    "avahi-locale-ca": {
      "origin": "avocado-qemuarm64",
      "recipe": "avahi",
      "version": "0.8-r0"
    },
    "avahi-locale-cs": {
      "origin": "avocado-qemuarm64",
      "recipe": "avahi",
      "version": "0.8-r0"
    },
    "avahi-locale-da": {
      "origin": "avocado-qemuarm64",
      "recipe": "avahi",
      "version": "0.8-r0"
    },
    "avahi-locale-de": {
      "origin": "avocado-qemuarm64",
      "recipe": "avahi",
      "version": "0.8-r0"
    },
    "avahi-locale-el": {
      "origin": "avocado-qemuarm64",
      "recipe": "avahi",
      "version": "0.8-r0"
    },
    "avahi-locale-en-au": {
      "origin": "avocado-qemuarm64",
      "recipe": "avahi",
      "version": "0.8-r0"
    },
    "avahi-locale-en-ca": {
      "origin": "avocado-qemuarm64",
      "recipe": "avahi",
      "version": "0.8-r0"
    },
    "avahi-locale-en-gb": {
      "origin": "avocado-qemuarm64",
      "recipe": "avahi",
      "version": "0.8-r0"
    },
    "avahi-locale-en-nz": {
      "origin": "avocado-qemuarm64",
      "recipe": "avahi",
      "version": "0.8-r0"
    },
    "avahi-locale-eo": {
      "origin": "avocado-qemuarm64",
      "recipe": "avahi",
      "version": "0.8-r0"
    },
    "avahi-locale-es": {
      "origin": "avocado-qemuarm64",
      "recipe": "avahi",
      "version": "0.8-r0"
    },
    "avahi-locale-et": {
      "origin": "avocado-qemuarm64",
      "recipe": "avahi",
      "version": "0.8-r0"
    },
    "avahi-locale-fa": {
      "origin": "avocado-qemuarm64",
      "recipe": "avahi",
      "version": "0.8-r0"
    },
    "avahi-locale-fi": {
      "origin": "avocado-qemuarm64",
      "recipe": "avahi",
      "version": "0.8-r0"
    },
    "avahi-locale-fo": {
      "origin": "avocado-qemuarm64",
      "recipe": "avahi",
      "version": "0.8-r0"
    },
    "avahi-locale-fr": {
      "origin": "avocado-qemuarm64",
      "recipe": "avahi",
      "version": "0.8-r0"
    },
    "avahi-locale-gl": {
      "origin": "avocado-qemuarm64",
      "recipe": "avahi",
      "version": "0.8-r0"
    },
    "avahi-locale-he": {
      "origin": "avocado-qemuarm64",
      "recipe": "avahi",
      "version": "0.8-r0"
    },
    "avahi-locale-hu": {
      "origin": "avocado-qemuarm64",
      "recipe": "avahi",
      "version": "0.8-r0"
    },
    "avahi-locale-id": {
      "origin": "avocado-qemuarm64",
      "recipe": "avahi",
      "version": "0.8-r0"
    },
    "avahi-locale-it": {
      "origin": "avocado-qemuarm64",
      "recipe": "avahi",
      "version": "0.8-r0"
    },
    "avahi-locale-ja": {
      "origin": "avocado-qemuarm64",
      "recipe": "avahi",
      "version": "0.8-r0"
    },
    "avahi-locale-ko": {
      "origin": "avocado-qemuarm64",
      "recipe": "avahi",
      "version": "0.8-r0"
    },
    "avahi-locale-lv": {
      "origin": "avocado-qemuarm64",
      "recipe": "avahi",
      "version": "0.8-r0"
    },
    "avahi-locale-ms": {
      "origin": "avocado-qemuarm64",
      "recipe": "avahi",
      "version": "0.8-r0"
    },
    "avahi-locale-nl": {
      "origin": "avocado-qemuarm64",
      "recipe": "avahi",
      "version": "0.8-r0"
    },
    "avahi-locale-oc": {
      "origin": "avocado-qemuarm64",
      "recipe": "avahi",
      "version": "0.8-r0"
    },
    "avahi-locale-pl": {
      "origin": "avocado-qemuarm64",
      "recipe": "avahi",
      "version": "0.8-r0"
    },
    "avahi-locale-pt-br": {
      "origin": "avocado-qemuarm64",
      "recipe": "avahi",
      "version": "0.8-r0"
    },
    "avahi-locale-ro": {
      "origin": "avocado-qemuarm64",
      "recipe": "avahi",
      "version": "0.8-r0"
    },
    "avahi-locale-ru": {
      "origin": "avocado-qemuarm64",
      "recipe": "avahi",
      "version": "0.8-r0"
    },
    "avahi-locale-sk": {
      "origin": "avocado-qemuarm64",
      "recipe": "avahi",
      "version": "0.8-r0"
    },
    "avahi-locale-sl": {
      "origin": "avocado-qemuarm64",
      "recipe": "avahi",
      "version": "0.8-r0"
    },
    "avahi-locale-sr": {
      "origin": "avocado-qemuarm64",
      "recipe": "avahi",
      "version": "0.8-r0"
    },
    "avahi-locale-sr+latin": {
      "origin": "avocado-qemuarm64",
      "recipe": "avahi",
      "version": "0.8-r0"
    },
    "avahi-locale-sv": {
      "origin": "avocado-qemuarm64",
      "recipe": "avahi",
      "version": "0.8-r0"
    },
    "avahi-locale-tr": {
      "origin": "avocado-qemuarm64",
      "recipe": "avahi",
      "version": "0.8-r0"
    },
    "avahi-locale-uk": {
      "origin": "avocado-qemuarm64",
      "recipe": "avahi",
      "version": "0.8-r0"
    },
    "avahi-locale-zh-cn": {
      "origin": "avocado-qemuarm64",
      "recipe": "avahi",
      "version": "0.8-r0"
    },
    "avahi-locale-zh-tw": {
      "origin": "avocado-qemuarm64",
      "recipe": "avahi",
      "version": "0.8-r0"
    },
    "avahi-src": {
      "origin": "avocado-qemuarm64",
      "recipe": "avahi",
      "version": "0.8-r0"
    },
    "avahi-utils": {
      "origin": "avocado-qemuarm64",
      "recipe": "avahi",
      "version": "0.8-r0"
    },
    "bison-locale-it": {
      "origin": "avocado-qemuarm64",
      "recipe": "bison",
      "version": "3.8.2-r0"
    },
    "bsdcpio": {
      "origin": "avocado-qemuarm64",
      "recipe": "libarchive",
      "version": "3.7.9-r0"
    },
    "bsdtar": {
      "origin": "avocado-qemuarm64",
      "recipe": "libarchive",
      "version": "3.7.9-r0"
    },
    "e2fsprogs-src": {
      "origin": "avocado-qemuarm64",
      "recipe": "e2fsprogs",
      "version": "1.47.0-r0"
    },
    "glibc-binary-localedata-am-et": {
      "origin": "avocado-qemuarm64",
      "recipe": "glibc-locale",
      "version": "2.39+git-r0"
    },
    "glibc-binary-localedata-gu-in": {
      "origin": "avocado-qemuarm64",
      "recipe": "glibc-locale",
      "version": "2.39+git-r0"
    },
    "glibc-binary-localedata-zh-cn.gbk": {
      "origin": "avocado-qemuarm64",
      "recipe": "glibc-locale",
      "version": "2.39+git-r0"
    },
    "glibc-charmap-tscii": {
      "origin": "avocado-qemuarm64",
      "recipe": "glibc-locale",
      "version": "2.39+git-r0"
    },
    "glibc-gconv-mac-sami": {
      "origin": "avocado-qemuarm64",
      "recipe": "glibc-locale",
      "version": "2.39+git-r0"
    },
    "glibc-localedata-i18n": {
      "origin": "avocado-qemuarm64",
      "recipe": "glibc-locale",
      "version": "2.39+git-r0"
    },
    "grep-locale-nb": {
      "origin": "avocado-qemuarm64",
      "recipe": "grep",
      "version": "3.11-r0"
    },
    "kernel-module-ebt-dnat-6.6.142-yocto-standard": {
      "origin": "avocado-qemuarm64",
      "recipe": "linux-yocto",
      "version": "6.6.142+git0+4a6f16d14b_1f7f3a52da-r0"
    },
    "kernel-module-xfrm-ipcomp-6.6.142-yocto-standard": {
      "origin": "avocado-qemuarm64",
      "recipe": "linux-yocto",
      "version": "6.6.142+git0+4a6f16d14b_1f7f3a52da-r0"
    },
    "libarchive": {
      "origin": "avocado-qemuarm64",
      "recipe": "libarchive",
      "version": "3.7.9-r0"
    },
    "libarchive-dbg": {
      "origin": "avocado-qemuarm64",
      "recipe": "libarchive",
      "version": "3.7.9-r0"
    },
    "libarchive-dev": {
      "origin": "avocado-qemuarm64",
      "recipe": "libarchive",
      "version": "3.7.9-r0"
    },
    "libarchive-doc": {
      "origin": "avocado-qemuarm64",
      "recipe": "libarchive",
      "version": "3.7.9-r0"
    },
    "libarchive-src": {
      "origin": "avocado-qemuarm64",
      "recipe": "libarchive",
      "version": "3.7.9-r0"
    },
    "libavahi-client3": {
      "origin": "avocado-qemuarm64",
      "recipe": "avahi",
      "version": "0.8-r0"
    },
    "libavahi-common3": {
      "origin": "avocado-qemuarm64",
      "recipe": "avahi",
      "version": "0.8-r0"
    },
    "libavahi-core7": {
      "origin": "avocado-qemuarm64",
      "recipe": "avahi",
      "version": "0.8-r0"
    },
    "libavahi-glib1": {
      "origin": "avocado-qemuarm64",
      "recipe": "avahi",
      "version": "0.8-r0"
    },
    "libavahi-gobject0": {
      "origin": "avocado-qemuarm64",
      "recipe": "avahi",